{
  "id": "a-plus-220-1202-lesson-00-import",
  "certification": "a-plus-220-1202",
  "lesson": "00",
  "title": "",
  "sourceFile": "data/transcripts/raw/a-plus-220-1202/00-title.srt",
  "cleanedFile": "data/transcripts/cleaned/a-plus-220-1202/00-title.txt",
  "conceptsFound": [],
  "newKnowledgeObjects": [],
  "updatedKnowledgeObjects": [],
  "possibleDuplicates": [],
  "needsReview": [],
  "notes": [],
  "status": "not-started"
}
